{
  "id": "gpt-5.6-luna-xhigh-cli",
  "type": "cli",
  "displayName": "GPT-5.6 Luna via Codex CLI (openai — quality coding, xhigh)",
  "capabilities": [
    "code",
    "refactor",
    "test",
    "docs",
    "data",
    "research"
  ],
  "modelFamily": "openai",
  "preferWhen": "Quality coding at extra-high reasoning effort: design-bearing or complex implementation, interface contracts, trade-off-laden changes, and careful refactors where correctness matters.",
  "avoidWhen": "Frontier-hard reasoning/diagnosis better suited to Sol; routine or high-volume mechanical work where normal-effort Luna suffices; security-sensitive work; visual/document deliverables.",
  "trusted": false,
  "cli": {
    "command": "codex",
    "args": [
      "exec",
      "--cd",
      "${workdir}",
      "--skip-git-repo-check",
      "-c",
      "model_reasoning_effort=xhigh",
      "-m",
      "gpt-5.6-luna",
      "-"
    ],
    "promptDelivery": "stdin",
    "cwd": "${workdir}",
    "env": {
      "SUPERCONDUCTOR_MANAGED_AGENT": "0"
    },
    "timeoutSec": 1500,
    "successExitCodes": [
      0
    ]
  },
  "output": {
    "channel": "stdout",
    "format": "text",
    "resultPointer": null
  }
}
