{
  "id": "gpt-5.6-sol-high-cli",
  "type": "cli",
  "displayName": "GPT-5.6 Sol via Codex CLI (openai — deep thinker, high)",
  "capabilities": [
    "code",
    "review",
    "refactor",
    "test",
    "research"
  ],
  "modelFamily": "openai",
  "preferWhen": "Deep reasoning that must land inside a budget: diff review, design review, and root-cause diagnosis where a verdict matters more than the last increment of depth. Default Sol variant for any task with a deadline or a large brief.",
  "avoidWhen": "Frontier-hard open-ended reasoning where depth beats latency (use max Sol); routine implementation (use Luna); security-sensitive work; visual/document deliverables.",
  "trusted": false,
  "cli": {
    "command": "codex",
    "args": [
      "exec",
      "--cd",
      "${workdir}",
      "--skip-git-repo-check",
      "-c",
      "model_reasoning_effort=high",
      "-m",
      "gpt-5.6-sol",
      "-"
    ],
    "promptDelivery": "stdin",
    "cwd": "${workdir}",
    "env": {
      "SUPERCONDUCTOR_MANAGED_AGENT": "0"
    },
    "timeoutSec": 1800,
    "successExitCodes": [
      0
    ]
  },
  "output": {
    "channel": "stdout",
    "format": "text",
    "resultPointer": null
  }
}
